Name,keywords,Id,Authors
"A. Adu Boahen - The author is one of Africa's most distinguished historians,",ghana sphinx ghanas riddle greek myth monster ghanas author africas ghana legon myth riddle university ghana sphinx ghana,"A. Adu Boahen - The author is one of Africa's most distinguished historians,",A. Adu Boahen
A. Alan B. Pritsker - Combines the presentation of a simulation language and the b,simulation manufacturing simulation support performing simulation simulation projects simulation language applications simulation simulation simulation newer chapter simulation ii simulation,A. Alan B. Pritsker - Combines the presentation of a simulation language and the b,A. Alan B. Pritsker
"A. Aubrey Bodine - ""Photography in the United States was a big thrill, but I al",bodines photographs bodine photographers collection photographs historical photographs photographs chronicled bodines chesapeake photographs maryland published bodines books books maryland,"A. Aubrey Bodine - ""Photography in the United States was a big thrill, but I al",A. Aubrey Bodine
A.E. van Vogt - Empire of the Atom is a science fiction novel by A.E. van Vo,empire atom atom science novel ae atom ae van empire plot gods gods stories copies novel vogts gods,A.E. van Vogt - Empire of the Atom is a science fiction novel by A.E. van Vo,A.E. van Vogt
Abner Cohen - Based on Cohen's fieldwork in the 1960s among the Hausa migr,african societies processes african nigeria custom urban anthropology urban africa hausa migrants nigeria anthropology african africa,Abner Cohen - Based on Cohen's fieldwork in the 1960s among the Hausa migr,Abner Cohen
Abraham Cohen - This invaluable study aid contains all five Books of the Bib,leviticus numbers exodus leviticus deuteronomy hebrew genesis exodus books bible leviticus hebrew text bible genesis jewish commentaries numbers deuteronomy,Abraham Cohen - This invaluable study aid contains all five Books of the Bib,Abraham Cohen
Adam Irving - nan,irving mucusart adam irving nan adam adam irving mucusart nan,Adam Irving - nan,Adam Irving
Adam McKeown - Witches with magical omens. Murder most foul. The quest for,reader shakespeare shakespeare play macbeth drama shakespeare witches magical retelling macbeth background shakespeare macbeth enhanced shakespeare witches,Adam McKeown - Witches with magical omens. Murder most foul. The quest for,Adam McKeown
Addison Wesley Longman - This collection of primary sources includes both classic and,american history diary excerpts history words american life sources public day sources story american letters diary primary sources lesserknown documents,Addison Wesley Longman - This collection of primary sources includes both classic and,Addison Wesley Longman
Adrian Davies - This handy pocket-sized book gives you quick and easy access,digital imaging pixel pentium imaging pixel pentium chip digital pixel imaging associated digital technological jargon definitions,Adrian Davies - This handy pocket-sized book gives you quick and easy access,Adrian Davies
Agatha Christie - El mismo día en que todos los miembros de la familia del mul,familia del la víctima la familia inmediatamente después del crimen víctima se multimillonario simeon el caso después que asesinato del,Agatha Christie - El mismo día en que todos los miembros de la familia del mul,Agatha Christie
"Agnes Repplier - Many of the earliest books, particularly those dating back t",modern editions earliest books republishing classic editions editions using expensive republishing quality modern books particularly books modern,"Agnes Repplier - Many of the earliest books, particularly those dating back t",Agnes Repplier
"Akira Toriyama - Your wish is granted...At long last, Akira Toriyama's action",ball dragon dragon balls dragon ball goku bulma goku goku ready tow goku bulma quest epic dragon collects dragon,"Akira Toriyama - Your wish is granted...At long last, Akira Toriyama's action",Akira Toriyama
"Alain C. Masquelet - As knowledge of anatomy becomes more sophisticated, influenc",microsurgery surgical anatomy described orthopaedic surgeons surgeons book anatomy sophisticated anatomy microsurgery understanding vascular surgical approaches advances microsurgery,"Alain C. Masquelet - As knowledge of anatomy becomes more sophisticated, influenc",Alain C. Masquelet
Alan F. Casy - 'It is indeed the merit of Dr. Alan F. Casy to bring in thes,medicinal stereochemistry stereochemistry discipline stereochemistry fear stereochemistry stereochemistry caused medicinal chemistry view medicinal chemistry pharmacology pharmacology medicinal,Alan F. Casy - 'It is indeed the merit of Dr. Alan F. Casy to bring in thes,Alan F. Casy
Alan P. Xenakis - Emmy winner Dr. Xenakis has produced a wealth of information,dr xenakis broadcast medicine television specials xenakis produced primetime television specials health concerns nbc xenakis medicine explores nbc renaissance,Alan P. Xenakis - Emmy winner Dr. Xenakis has produced a wealth of information,Alan P. Xenakis
"Alan Ross - Stats, team lists, and all the info a fan would need to foll",cardinals follow cardinals cardinals start world series stats series season team lists stats team fan need lists info,"Alan Ross - Stats, team lists, and all the info a fan would need to foll",Alan Ross
Albert E. Sloane - nan,thomas publisher publisher sloane charles charles thomas albert sloane thomas sloane nan albert charles nan,Albert E. Sloane - nan,Albert E. Sloane
Albert White Hat Sr. - A set of spoken-language instructional discs to accompany th,lakota language writing lakota spokenlanguage instructional lakota spokenlanguage instructional discs set spokenlanguage reading writing accompany text language,Albert White Hat Sr. - A set of spoken-language instructional discs to accompany th,Albert White Hat Sr.
Alex Warleigh - Understanding the institutions of the European Union is vita,institutions european european union understanding institutions institutions institutions explains development european institutions considers main institutions european unionkey development institutions,Alex Warleigh - Understanding the institutions of the European Union is vita,Alex Warleigh
"Alex Wheatle - As close as brothers, the four boys in this novel each have",boys novel forest story escaping forest brothers boys close brothers forest feel freedom forest inner demon brothers forest,"Alex Wheatle - As close as brothers, the four boys in this novel each have",Alex Wheatle
Alexander Gerybadze - nan,alexander gerybadze walter gruyter gerybadze walter gruyter nan alexander gerybadze alexander walter nan,Alexander Gerybadze - nan,Alexander Gerybadze
Alexander Marx - Thymic epithelial tumors are rare and mostly malignant human,thymic epithelial thymoma patients nonorganotypic thymic treating thymoma development thymic subtypes thymic thymoma epithelial tumors thymic epithelial tumor,Alexander Marx - Thymic epithelial tumors are rare and mostly malignant human,Alexander Marx
Alexandre B. Tsybakov - La theorie de l'estimation non-parametrique s'est developpee,optimales vitesses optimales techniques minoration minimax lestimation nonparametrique optimales convergence des estimateurs estimateurs et estimateurs risque minimax,Alexandre B. Tsybakov - La theorie de l'estimation non-parametrique s'est developpee,Alexandre B. Tsybakov
Alfred Bester - IN A COSMIC CON GAME OF DEATH AND DECEPTION IT'S WINNER TAKE,manchu rogue triton rogue manchu duke deadly manchu death demi demonic manchu reign rogues following manchus manchus trail rogue encounters,Alfred Bester - IN A COSMIC CON GAME OF DEATH AND DECEPTION IT'S WINNER TAKE,Alfred Bester
"Alfred Brian Pippard - First published in 1989, this book contained the first syste",magnetoresistance metals magnetoresistance account magnetoresistance metals phenomenon metals study metals electrical magnetic breakdown solidstate physicists metal behaves solidstate physics,"Alfred Brian Pippard - First published in 1989, this book contained the first syste",Alfred Brian Pippard
Alfred Russel Wallace - The eight key titles re-published in this set make important,victorian phenomenon influential victorian victorian eightvolume set important texts individual volumes key titles eightvolume volumes texts,Alfred Russel Wallace - The eight key titles re-published in this set make important,Alfred Russel Wallace
Alison M. Scott - This book is a path-breaking collection of essays which expl,modernism fallout bomb american atomic bomb american art american culture crisis bomb modernism abstract bomb bomb collection age 19451962,Alison M. Scott - This book is a path-breaking collection of essays which expl,Alison M. Scott
"Alissa Quart - <b>A devastating indictment of the ""gifted child"" myth</b> <",gifted children gifted child enhance giftedness giftedness giftedness questions gifted negotiated gifted produce gifted achieve kids achievement thoughtful,"Alissa Quart - <b>A devastating indictment of the ""gifted child"" myth</b> <",Alissa Quart
"Alistair Moffat - Only one period in history is immediately, indelibly and uni",reivers borders european history border dumfriesshire period history story reivers britain modern english border landscape larceny carlisle swords area scottish,"Alistair Moffat - Only one period in history is immediately, indelibly and uni",Alistair Moffat
Allan Greenwood - The principles of the First Edition--to teach students and e,electrical transients transient problems transients transients equip surge arresters transient transients necessarily solve transient oxide surge surge,Allan Greenwood - The principles of the First Edition--to teach students and e,Allan Greenwood
Allan N. Schore - A desktop reference to the terms and concepts in this burgeo,psychotherapy neuroscience neuroscience psychopathology developmental science psychopathology developmental neuroscience neuroscience relevance psychotherapy advances neuroscience science psychotherapy,Allan N. Schore - A desktop reference to the terms and concepts in this burgeo,Allan N. Schore
Alvar Aalto - First published in 1994. Routledge is an imprint of Taylor &,routledge imprint francis informa informa company routledge 1994 routledge imprint taylor informa published 1994 amp francis taylor amp,Alvar Aalto - First published in 1994. Routledge is an imprint of Taylor &,Alvar Aalto
Alvin J. Esau - <i>The Courts and the Colonies</i> offers a detailed account,law hutterites hutterite history hutterite colony hutterite factions arising hutterite hutterites hutterite various hutterite courts colonies did courts,Alvin J. Esau - <i>The Courts and the Colonies</i> offers a detailed account,Alvin J. Esau
Amanda Young - Sara believed Tristan died while stationed overseas. The las,tristan sara killer sara sara believed tristan died possess sara alivewith sara life tristan truth tristan believed tristan tristan determined,Amanda Young - Sara believed Tristan died while stationed overseas. The las,Amanda Young
Amarjit Basra - Discusses the mechanisms of plant productivity and the facto,net photosynthesis plant productivity photosynthesis plant nutrition plant genes photosynthesis describing mechanisms plant specific plant nutrition uptake carbon,Amarjit Basra - Discusses the mechanisms of plant productivity and the facto,Amarjit Basra
Amaryllis Verhoeven - European integration confronts us with the limits of current,european constitution constitutionalism eu eu citizenship eu law eu decisionmaking european integration meaning eu european national european union integration european,Amaryllis Verhoeven - European integration confronts us with the limits of current,Amaryllis Verhoeven
Amber Dawn Baker - Financial Stability for the Modest Income is a book designed,financial stability modest income stability modest income book stability debt debt personal income help financial accustomed financial debt free,Amber Dawn Baker - Financial Stability for the Modest Income is a book designed,Amber Dawn Baker
Amber Grayson - nan,grayson siena nan amber amber grayson siena amber nan grayson,Amber Grayson - nan,Amber Grayson
American Heart Association - nan,potter publishers clarkson potter publishers association clarkson american heart potter heart association clarkson heart nan american,American Heart Association - nan,American Heart Association
American Psychological Association - Graduate Study in Psychology offers complete practical infor,psychology programs graduate study psychology education study psychology psychology offers programs degrees graduate housing graduate 500 psychology degrees offered,American Psychological Association - Graduate Study in Psychology offers complete practical infor,American Psychological Association
Amira El-Azhary Sonbol - The eighteen essays in this volume cover a wide range of mat,muslim women women sharia studies muslim ottoman household courts ottoman sharia courts ottoman sharia muslim womens studies,Amira El-Azhary Sonbol - The eighteen essays in this volume cover a wide range of mat,Amira El-Azhary Sonbol
Amy H. Sturgis - This work offers the best of both worlds: broad analysis of,overview presidents issue presidents founding presidents analysis presidential presidents critics presidents administration administration presidents presidents presidential memoirs opposing presidents,Amy H. Sturgis - This work offers the best of both worlds: broad analysis of,Amy H. Sturgis
Amy Seely Flint - Tools and techiniques for solving math problems and developi,math literacy developing math literacy math problems solving math tools techiniques techiniques solving math tools problems developing,Amy Seely Flint - Tools and techiniques for solving math problems and developi,Amy Seely Flint
"Andrew Clements - Greg had started looking around the cafeteria, and everywher",forever school school suddenly pencils quarters greg kenton school changed kids school greg started school moment greg decided school,"Andrew Clements - Greg had started looking around the cafeteria, and everywher",Andrew Clements
"Andrew E. Maugham - ""A brilliant tale. Truly a novel of epic proportions. It tak",novel epic truly novel ideas heaven novel brilliant tale end book book heaven hell heaven tale truly,"Andrew E. Maugham - ""A brilliant tale. Truly a novel of epic proportions. It tak",Andrew E. Maugham
Andrew Kakabadse - Being the chairman of a company is <i>the</i> top job. Forge,chairmans role chairmen chairmans chairmans chairman chairman leading succeed chairman chairman company worlds chairmen chairman combining chairmen hire,Andrew Kakabadse - Being the chairman of a company is <i>the</i> top job. Forge,Andrew Kakabadse
"Andrew Leckey - <b>Andrew Leckey,</b> nationally syndicated investment colum",investment columnist business journalism economics journalism editor financial business editors columnist columnist chicago forbes sloan editor forbes andrew leckey,"Andrew Leckey - <b>Andrew Leckey,</b> nationally syndicated investment colum",Andrew Leckey
"Andrew M. Greeley - In 12 chapters, priest-sociologist Andrew Greeley, covers th",chapters priestsociologist priestsociologist andrew priestsociologist christian life prudence life faith everyday christian fortitude prudence faith love temperance justice,"Andrew M. Greeley - In 12 chapters, priest-sociologist Andrew Greeley, covers th",Andrew M. Greeley
Andrew Mollo - nan,janes publishers macdonald janes publishers mollo macdonald nan andrew macdonald nan andrew mollo janes andrew,Andrew Mollo - nan,Andrew Mollo
Andrew P. Johnson - This user-friendly text provides students with everything a,action research educational research learner qualitative research methods students preservice action research research edition techniques educational inservice teacher,Andrew P. Johnson - This user-friendly text provides students with everything a,Andrew P. Johnson
"Andrew Wilson - This volume describes the history, both pre-preservation and",preserved railways railways middleton railway railway kirkness railway middleton light railways railway railways including light railway lancashire preserved,"Andrew Wilson - This volume describes the history, both pre-preservation and",Andrew Wilson
"Andrews Joh Andrews - Lightning Injuries: Electrical, Medical, and Legal Aspects p",lightning injuries lightning injury injury lightning protection lightning epidemiology lightning patients lightning lightning strikes injuries electrical lightning phenomena physics lightning,"Andrews Joh Andrews - Lightning Injuries: Electrical, Medical, and Legal Aspects p",Andrews Joh Andrews
Andy Andrews - Storms of Perfection 4 is a collection of fictional letters,storms perfection author andy perfection collection bestselling author author fictional letters usedoriginally published twain booker mark twain twain,Andy Andrews - Storms of Perfection 4 is a collection of fictional letters,Andy Andrews
Aneesha Bakharia - Pinnacle Studio's easy-to-use interface makes it a useful pl,camcorder pinnacle studios intermediate camcorder studios easytouse camcorder user easytouse interface pinnacle easytouse film edit capabilities software,Aneesha Bakharia - Pinnacle Studio's easy-to-use interface makes it a useful pl,Aneesha Bakharia
"Angela McAllister - Nancy knows that she and her pen pal, Ally, are going to be",nancys nancys boundless celebration friendshipthis best pals nancy sisters moment energy nancys pal ally ally going nancy knows,"Angela McAllister - Nancy knows that she and her pen pal, Ally, are going to be",Angela McAllister
Anita Price Davis - nan,nan anita davis research research education anita price education association price davis davis anita nan education,Anita Price Davis - nan,Anita Price Davis
Ann Belford Ulanov - How does the spirit come into clinical work? Through the ana,psychotherapy spirituality psychoanalysis surviving psychoanalysis offer psychoanalysis psychotherapy spirituality spirituality compete nonviolence dreams destructiveness embrace spiritual life,Ann Belford Ulanov - How does the spirit come into clinical work? Through the ana,Ann Belford Ulanov
"Ann G. Klein - An early educator voice has been forgotten, even though her",educator author early educator leta hollingworth hollingworth graduated hollingworth 18861939 school gifted gifted published author feminist educator influential feminist,"Ann G. Klein - An early educator voice has been forgotten, even though her",Ann G. Klein
Ann Heinrichs - Few characters from our storied history as a nation will be,benjamin franklin readers benjamin franklin benjamin inventor charming founding father franklin exploits young readers history nation genius inventor,Ann Heinrichs - Few characters from our storied history as a nation will be,Ann Heinrichs
"Anna Grossnickle Hines - ""I'm going to show you I everything,"" big brother says proud",new sibling big brother discoveries childs sibling recalling sibling brother says picture book going big childs yeara guide wonders,"Anna Grossnickle Hines - ""I'm going to show you I everything,"" big brother says proud",Anna Grossnickle Hines
Anna Wohlin - Brian Jones has been hailed as one of the truly influential,jones killed brian jones brians music stones brians night brian rolling stones death rock brian rock roll jones hailed,Anna Wohlin - Brian Jones has been hailed as one of the truly influential,Anna Wohlin
Anne  Jordan - nan,nelson thornes nan anne anne jordan thornes anne jordan nelson nan nelson jordan,Anne  Jordan - nan,Anne  Jordan
"Anne Butler - This isn't your ordinary cookbook. It offers a historical, p",ordinary cookbook cookbook local recipes heritage dishes cookbook offers louisianas diverse southern louisiana recipes celebrate louisianas recipes rich,"Anne Butler - This isn't your ordinary cookbook. It offers a historical, p",Anne Butler
"Anne Enright - A dazzling writer of international stature, Anne Enright is",anne enright enright irelands enright enrights anne dublin wake enrights work 1968 enright dazzling writer enright traces,"Anne Enright - A dazzling writer of international stature, Anne Enright is",Anne Enright
Anne M. Todd - War. When? Where? Why? This series delivers an in-the-trench,war series civil war war reconstruction wars studied wars war soldiers fought perspective wars reality war fought country,Anne M. Todd - War. When? Where? Why? This series delivers an in-the-trench,Anne M. Todd
"Anne McCaffrey - Pursuing her dream to be a Harper of Pern, Menolly studies u",studies masterharper menolly studies harper pern masterharper learning pern menolly dream harper pursuing dream masterharper menolly pern,"Anne McCaffrey - Pursuing her dream to be a Harper of Pern, Menolly studies u",Anne McCaffrey
Annette Patterson - Reading and Writing about short stories.,short stories reading writing writing short reading writing stories short,Annette Patterson - Reading and Writing about short stories.,Annette Patterson
"Annie Buckley - Babysitting is a great job. It's great fun, and it's a great",babysitting great better babysitter babysitting babysitter great tips fun great tips better book job job great,"Annie Buckley - Babysitting is a great job. It's great fun, and it's a great",Annie Buckley
"Anonymous - 17 songs for recorder solo or duet, including: Deck the Hall",17 songs recorder solo solo duet songs recorder duet including songs night silent duet silent night midnight clear,"Anonymous - 17 songs for recorder solo or duet, including: Deck the Hall",Anonymous
Anonymous - nan,nan anonymous leonard publishing anonymous hal publishing corporation hal leonard nan anonymous hal publishing corporation,Anonymous - nan,Anonymous
Anthea Tinker - <i>Older People in Modern Society</i> is an established clas,older people literature older people modern modern society medicine sociology abuse older older modern sociology social policy,Anthea Tinker - <i>Older People in Modern Society</i> is an established clas,Anthea Tinker
"Anthony Trollope - An engrossing tale of love, identity and anxieties of two me",novel nineteenthcentury realism tale love engrossing tale men desmonds crafted novel love identity love ineradicable desmonds fitzgeralds realism,"Anthony Trollope - An engrossing tale of love, identity and anxieties of two me",Anthony Trollope
"Anton Chekhov - Olga, Masha and Irina lead a drab life in a provincial garri",olga masha masha irina escaping moscow moscow critics drama 20th irina olga moscow irina lead best drama,"Anton Chekhov - Olga, Masha and Irina lead a drab life in a provincial garri",Anton Chekhov
Anton Chekhov - This little farce is very popular and one of the funniest ev,funniest written little farce written story farce popular farce quarrel boundary popular funniest quarrel funniest starts propose,Anton Chekhov - This little farce is very popular and one of the funniest ev,Anton Chekhov
Antoon Krings - Vibrant and humorous stories introduce four curious little c,insects perspective insects world insects little critters critters young sneedle beetle insecto insecto través critters garden adventures,Antoon Krings - Vibrant and humorous stories introduce four curious little c,Antoon Krings
Anura Guruge - This is a soup-to-nuts reference guide on all aspects of Web,web services services web internetspecific middleware ebusiness standardization guide aspects services given portal implementers aspects ebusiness services web,Anura Guruge - This is a soup-to-nuts reference guide on all aspects of Web,Anura Guruge
Ariel Glucklich - Why would anyone seek out the very experience the rest of us,ritual pain sacred pain psychological spiritual spiritual sickness shamans taoists experience ritual spiritual effects meaningful suffering identity spiritual spiritual seeker,Ariel Glucklich - Why would anyone seek out the very experience the rest of us,Ariel Glucklich
Arno Lindner - nan,academic publishers publishers wageningen academic lindner wageningen arno lindner nan arno academic wageningen lindner nan,Arno Lindner - nan,Arno Lindner
"Arthur E. Green - Needed to fight in the western theater of operations, the 38",38th infantry fought 38th army tennessee surrender 1865 alabama volunteers 38th alabama fight chattanooga alabama 1862 operations 38th mobile 1863,"Arthur E. Green - Needed to fight in the western theater of operations, the 38",Arthur E. Green
Arthur Zilversmit - Nearly one hundred years ago America's foremost philosopher,progressive education education movement educational reform impact deweys deweys ideas progressivism 1930s children progressive practices school establishing schools school practices,Arthur Zilversmit - Nearly one hundred years ago America's foremost philosopher,Arthur Zilversmit
"Arturo Pérez-Reverte - Andrés Faulques, a world-renowned war photographer, has retr",andrés faulques asks faulques faulques fate faulques wouldbe faulques war faulques faulques struggles taken faulques faulques forced faulques stranger,"Arturo Pérez-Reverte - Andrés Faulques, a world-renowned war photographer, has retr",Arturo Pérez-Reverte
Arvella Whitmore - Jordan Scott has made his decision. To stay in the hood. Wit,gang cobras hood gang trapped gang daddy left cobras rough gang cobras gang thing rough daddy jordan scott,Arvella Whitmore - Jordan Scott has made his decision. To stay in the hood. Wit,Arvella Whitmore
