Name,keywords,Id,Authors
Judy Batt - The papers that comprise this collection examine the role of,european states ethnic regional eastern european regional identities european national national ethnic competing european government soviet ethnic european,Judy Batt - The papers that comprise this collection examine the role of,Judy Batt
Jules Verne - The story involves German professor Otto Lidenbrock who beli,icelandic volcano stromboli volcano volcano sn volcano believes volcanic volcanic volcanic tubes otto lidenbrock prehistoric professor otto,Jules Verne - The story involves German professor Otto Lidenbrock who beli,Jules Verne
Juliet John - This is the first major study of Dickens's villains. They em,dramatic dickens dickenss villains study dickenss dickens book dickens dickenss melodramatic aesthetics macabre dramatic john argues implications melodramatic,Juliet John - This is the first major study of Dickens's villains. They em,Juliet John
"Julius Lester - In a gray fieldstone house in Nashville, Tennessee, the Reve",remember published lord remember reverend joshua remembering years evangelist white reverend tennessee reverend remembering black churches 1960s tears,"Julius Lester - In a gray fieldstone house in Nashville, Tennessee, the Reve",Julius Lester
Jurgen Brauer - Countries that spend scarce resources to import arms from ab,arms trade armsimporting country arms abroad import arms proceeds armsimporting arms sellers armsimporting defence economists applications arms socalled arms,Jurgen Brauer - Countries that spend scarce resources to import arms from ab,Jurgen Brauer
Justin P. Petrillo - Psychiatrist Jason Luna's fiancee is murdered by a Man claim,psychiatrist jason jason luna jason lunas lunas fiancee dr luna werewolf dr luna real lycanthropes real killerbut jason werewolf,Justin P. Petrillo - Psychiatrist Jason Luna's fiancee is murdered by a Man claim,Justin P. Petrillo
"János Kornai - This book provides a comprehensive account of the structure,",planned economies economies eastern socialist economy reforming socialist europe ussr ussr communist ussr poland countries ussr eastern europe socialist state,"János Kornai - This book provides a comprehensive account of the structure,",János Kornai
K. Paul Yoon - This volume offers social scientists a concise overview of m,attribute decision decisionmaking decisionmaking process madm methods existing decisionmaking scoring methods decision making optimal decisionsthe normative models multiple attribute,K. Paul Yoon - This volume offers social scientists a concise overview of m,K. Paul Yoon
K.A. Applegate - The Yeerks are not the only invaders of Earth. Meet the new,yeerks invaders enemy helmacrons invaders earth helmacrons cassie yeerks invaders new enemy helmacrons tiny hostages animorphs helmacrons,K.A. Applegate - The Yeerks are not the only invaders of Earth. Meet the new,K.A. Applegate
Karen E. Haas - nan,haas mfa karen haas mfa publications nan karen mfa karen haas nan publications,Karen E. Haas - nan,Karen E. Haas
Karen Gravelle - Explores various aspects of teenage fatherhood through the e,teenage fatherhood teenage fathers fatherhood experiences fathers fatherhood experiences thirteen thirteen teenage aspects teenage teenage thirteen,Karen Gravelle - Explores various aspects of teenage fatherhood through the e,Karen Gravelle
Karen Hansen - The archeologist Maria Gimbutas left us the gift of symbols,goddess jungian archetypal feminine dark goddesses goddesses work goddesses archeologists theologians archeologist maria sites goddess goddess jungian,Karen Hansen - The archeologist Maria Gimbutas left us the gift of symbols,Karen Hansen
Karen Kampwirth - The revolutionary movements that emerged frequently in Latin,movements nicaragua revolutionary movements revolutionaries cuban revolutionary experiences revolutionaries participated guerrilla guerrilla activities participate guerrilla revolutions understanding revolutions,Karen Kampwirth - The revolutionary movements that emerged frequently in Latin,Karen Kampwirth
Karen McCall - Bargain Books are non-returnable.For those whose idea of sma,workbook money money management smart money bargain books finances retirement finances money author evaluating finances financial future author financial,Karen McCall - Bargain Books are non-returnable.For those whose idea of sma,Karen McCall
Karen Whiddon - He'd lost his job. His reputation. His family's regard. And,dominic cordasic pi dominic dominic looked help dominic dominic rachel trusted widow rachel betrayal pi betrayal rachel,Karen Whiddon - He'd lost his job. His reputation. His family's regard. And,Karen Whiddon
"Karl Kirchwey - Thirty-eight poems by an important young poet, winner of the",poems important thirtyeight poems poet winner young poet poems poet rome gentle prix rome rome timeless kirchwey,"Karl Kirchwey - Thirty-eight poems by an important young poet, winner of the",Karl Kirchwey
Karl Petzke - nan,petzke hädecke karl petzke nan karl petzke hädecke nan karl,Karl Petzke - nan,Karl Petzke
Kasey Michaels - BOY TROUBLE .. .<br /><br />Just what was widower Daniel Qui,widower daniel convince daniel chance daniel daniel meant daniel quinn daniel daniel perfection abbott daniel boy trouble quinn supposed,Kasey Michaels - BOY TROUBLE .. .<br /><br />Just what was widower Daniel Qui,Kasey Michaels
Kate Hayden - Experience the unimaginable power and force of a tornado thr,tornado vivid force tornado tornado reallife stories vivid reallife stories experience unimaginable unimaginable power reallife vivid,Kate Hayden - Experience the unimaginable power and force of a tornado thr,Kate Hayden
Kate Thompson - JJ has grown-up and has a family of his own: he's married to,ghost jennys persuade ghost ghost doesnt beacon pucas ghost talking ghost puca plan plan jj entirely ghost takes jenny,Kate Thompson - JJ has grown-up and has a family of his own: he's married to,Kate Thompson
Katharine Le Mée - Western music originates in the Gregorian chant sung in Bene,benedictine musicians sung benedictine benedictine monasteries sung liturgy liturgy prayer musicians medieval monasteries europe gregorian chant benedictine liturgy,Katharine Le Mée - Western music originates in the Gregorian chant sung in Bene,Katharine Le Mée
"Katharine Washburn - The American scene, once so full of richness, promise, vital",critics dispiriting pancultural dumbing culture jurisprudence dismay culture education politics pancultural essays dumbing journalism literature literature ethics tradition competence,"Katharine Washburn - The American scene, once so full of richness, promise, vital",Katharine Washburn
"Katherine Paterson - In speeches, essays, and book reviews, the novelist Katherin",novelist katherine paterson discusses novelist childrens books katherine paterson reviews novelist writes childrens books ideas essays book paterson,"Katherine Paterson - In speeches, essays, and book reviews, the novelist Katherin",Katherine Paterson
Kathleen Ragan - Dismayed by the predominance of male protagonists and heroes,heroines courageous heroes daughters forgotten heroines folktales daughters books 100 folktales folktales celebrate books kathleen strong heroines courageous mothers,Kathleen Ragan - Dismayed by the predominance of male protagonists and heroes,Kathleen Ragan
"Kathryn Lasky - Here is the untold story of Henry, a simple farmer who stumb",story henry nature henry henry transformation henry simple farmer stumbles henry farmer simple farmer barnyard kathryn talewith royally,"Kathryn Lasky - Here is the untold story of Henry, a simple farmer who stumb",Kathryn Lasky
Katrina L. Cassel - Great information for teens on how to make their families be,information teens discover god teens teens make thinking created god thinking make families families better families great information,Katrina L. Cassel - Great information for teens on how to make their families be,Katrina L. Cassel
Kay Hooper - Imprisoned by fate -- and the FBI -- in a strange town with,imprisoned fate surrender lara lara told game lara fate future lara lara lara willing devon shane imprisoned,Kay Hooper - Imprisoned by fate -- and the FBI -- in a strange town with,Kay Hooper
"Keir Starmer - This work explores the early struggles, tradgedies and succe",falkland islands falkland members falkland antarctic stations antarctic islands dependencies small antarctic islands dependencies survey dependencies,"Keir Starmer - This work explores the early struggles, tradgedies and succe",Keir Starmer
Keith Famie - Insatiable globe-trotter. Television impresario. Rolling sto,gourmet keith chefs famie keith famie adventures cooking personality chef chef famie adventures kenya food classic dishes keith,Keith Famie - Insatiable globe-trotter. Television impresario. Rolling sto,Keith Famie
Ken Duncan - nan,duncan panographs duncan ken ken duncan duncan panographs nan ken nan ken,Ken Duncan - nan,Ken Duncan
Ken Setterington - When Rosie comes home to find her mom dancing alone in the l,rosie comes rosie mom dancing mum getting announces mum mothers announces celebration love joyous celebration mothers home mom,Ken Setterington - When Rosie comes home to find her mom dancing alone in the l,Ken Setterington
Kennedy Information - nan,kennedy information information kennedy nan kennedy kennedy information nan,Kennedy Information - nan,Kennedy Information
"Kenneth S. Baer - When Bill Clinton declared in 1996 that ""the era of big gove",fdrreinventing democrats presidencydrawing dlc clintonthe dlcs democratic party democrats reformed democrats party encouraged clintons new democrats democrats story new democratic,"Kenneth S. Baer - When Bill Clinton declared in 1996 that ""the era of big gove",Kenneth S. Baer
Kerry A. Jones - Can a long-ago love be rekindled? When a flashflood carries,megan left rekindled flashflood megan landers carries megan hideaway abduction form megan megan love rekindled meg landers rekindled,Kerry A. Jones - Can a long-ago love be rekindled? When a flashflood carries,Kerry A. Jones
Kerry L. Sommerville - A practical resource for managers and supervisors in hospita,hospitality industrypractice hospitality employee supervisors hospitality hospitality industryrather hospitality industry businessesin hospitality resources hospitality hospitality businessesin hrm experiences practitioners hospitality,Kerry L. Sommerville - A practical resource for managers and supervisors in hospita,Kerry L. Sommerville
"Kevin  Ireland - The result of 12 months of research, more than 2,000 phone c",months research interviews 1200 research research 2000 sources people insider sources programs offered guide littleknown nonprofit agencies interviews,"Kevin  Ireland - The result of 12 months of research, more than 2,000 phone c",Kevin  Ireland
"Kevin  Kelly - An international success at thirty-two, Michael Bennett crea",broadway legend stephen sondheim musical history musical glittering broadway bennett glittering theatrical biography fame bennett created broadway neil simon,"Kevin  Kelly - An international success at thirty-two, Michael Bennett crea",Kevin  Kelly
Kevin Featherstone - This rare focus on the politics of contemporary Greece explo,policy greece contemporary greece greeces relations democracy greece greece period affected greeces greece explores consequence greeces greeces membership divisions greece,Kevin Featherstone - This rare focus on the politics of contemporary Greece explo,Kevin Featherstone
Klara Csapodine Gardonyi - nan,gardonyi akademiai akademiai kiads klara csapodine nan klara csapodine gardonyi akademiai klara csapodine kiads gardonyi,Klara Csapodine Gardonyi - nan,Klara Csapodine Gardonyi
"Koreaki Kamuro - <i>Sex Friend,</i> a collection of <i>shonen-ai</i> (gay-the",gaythemed manga relationship yuu sex friend friend kyoichi manga follows shonenai gaythemed follows haruki manga kawamura just couples,"Koreaki Kamuro - <i>Sex Friend,</i> a collection of <i>shonen-ai</i> (gay-the",Koreaki Kamuro
Korinsha Press - nan,korinsha press press korinsha nan korinsha korinsha nan press,Korinsha Press - nan,Korinsha Press
"L.A. Graham - For decades, professionals in applied mathematics and mathem",number systems mathematics probabilities distances mathematics mathematical applied mathematics distances number mathematical distances number theory finest problems,"L.A. Graham - For decades, professionals in applied mathematics and mathem",L.A. Graham
Lannie Rose - nan,lannie rose fell publishers nan lannie rose frederick publishers lannie frederick fell rose nan frederick,Lannie Rose - nan,Lannie Rose
"Larry V. Hedges - Schools are complex social settings where students, teachers",schools social school norms social scholastic school accountability legitimize teaching school culture education organizational better teachers organization schooling profession social,"Larry V. Hedges - Schools are complex social settings where students, teachers",Larry V. Hedges
Lars Johanson - <p><b>The Turkic Languages</b> examines the modern languages,turkic languages turkic language family modern languages language familythe languages language individual languages language description languages lexis dialects,Lars Johanson - <p><b>The Turkic Languages</b> examines the modern languages,Lars Johanson
"Lauren Thompson - <br />One day when Little Quack is playing in the pond, he h",pond ducklings little quack playing pond pond hears ducklings frog pond pond quack playing piddle puddle quacking,"Lauren Thompson - <br />One day when Little Quack is playing in the pond, he h",Lauren Thompson
Lawrence E. Shapiro - This activity book helps children acquire the skills to make,helps children activity book communication skills inviting child children acquire book helps reading nonverbal children new friends choosing friends,Lawrence E. Shapiro - This activity book helps children acquire the skills to make,Lawrence E. Shapiro
"Lawrence F. Lowery - More than 1000 activities using simple materials, organized",organic matter inorganic matter matter organic categories inorganic inorganic matter energy activities using materials organized simple materials activities,"Lawrence F. Lowery - More than 1000 activities using simple materials, organized",Lawrence F. Lowery
Leigh Michaels - Darcy Malone can't quite believe she's let smooth-talking ty,wants darcy darcys resolve darcy act darcy darcys darcy malone share darcys tycoon trey business trey smoothtalking tycoon,Leigh Michaels - Darcy Malone can't quite believe she's let smooth-talking ty,Leigh Michaels
Leland Graham - Students will never need to worry about preparing a Social S,presentation preparing social students need social studies studies fair captivating presentation topic designing project comprehensive fair project leads students,Leland Graham - Students will never need to worry about preparing a Social S,Leland Graham
Len Blanchard - The epic tale of the life and death of the great Sioux warri,horse resurrected crazy horse horse crazy great sioux horse sioux warrior sioux dog remarkable missouri river epic tale,Len Blanchard - The epic tale of the life and death of the great Sioux warri,Len Blanchard
Lennart Nilsson - The fourth edition of this beloved classic--completely revis,fourth edition nilssons child masterpiececompletely revised timeless masterpiececompletely classiccompletely revised birth timeless beloved classiccompletely edition beloved revolutionary photographic womb completely,Lennart Nilsson - The fourth edition of this beloved classic--completely revis,Lennart Nilsson
Leo Finkelstein Jr. - Geared specifically to the needs of engineering and science,engineering science needs engineering engineering technical business appropriate technical technical students book business writing tools examples writing provides,Leo Finkelstein Jr. - Geared specifically to the needs of engineering and science,Leo Finkelstein Jr.
Leonard Gillman - nan,gillman norton norton company norton leonard gillman nan leonard gillman company nan leonard,Leonard Gillman - nan,Leonard Gillman
Leonard L. Lance - The new edition provides quick access to thousands of drug n,drug names drugs listed dosage forms medical language indicationtherapeutic category therapeutic category forms drugs 2004 drugs indicationtherapeutic condition drugs,Leonard L. Lance - The new edition provides quick access to thousands of drug n,Leonard L. Lance
Leonard Leshuk - Leonard Leshuk begins this study by commenting on the unusua,soviet union ii soviet militarily global world war soviet usa militarily leonard leshuk backward world war ii nation seemingly,Leonard Leshuk - Leonard Leshuk begins this study by commenting on the unusua,Leonard Leshuk
Leonard Stein - nan,history ebook stein acls ebook project acls history ebook leonard stein nan leonard history stein acls,Leonard Stein - nan,Leonard Stein
Leslie Alcock - nan,university wales wales press alcock university leslie alcock alcock wales university nan leslie nan leslie,Leslie Alcock - nan,Leslie Alcock
Leslie Norris - His poetry seeks to transcend the limits of earthbound Man a,poetry seeks volume poetry poetry nature tenth limits earthbound earthbound man seeks transcend tenth volume nature transcend limits,Leslie Norris - His poetry seeks to transcend the limits of earthbound Man a,Leslie Norris
"Leslie Thomas - A delightfully rauchy story... a lovely blend of humour, sex",tale welsh lifetimes odyssey adventure story tale quest rollicking tale inhabits bestseller pilgrimage lifetimes best book mans pilgrimage adventure,"Leslie Thomas - A delightfully rauchy story... a lovely blend of humour, sex",Leslie Thomas
"Lewis A. Lawson - These collected interviews, like a visit with Percy at his h",percys novel publication percys percy scholars percy works visit percy thomas mertonthis use percy percy know percy percys,"Lewis A. Lawson - These collected interviews, like a visit with Percy at his h",Lewis A. Lawson
Liam Chambers - This study examines politicisation and rebel lion in County,examining kildare kildare examining county kildare kildare polarised irish kildare iod irish soc irish examines politicisation politicisation rebel,Liam Chambers - This study examines politicisation and rebel lion in County,Liam Chambers
"Lillian B. Rubin - As timely today as when it was first published in 1976, this",author lillian lillian rubin books written workingclass families published 1976 important books bestselling author rubin universally written workingclass today published,"Lillian B. Rubin - As timely today as when it was first published in 1976, this",Lillian B. Rubin
Lily Chuang - Being a vegetarian is the secret to longevity. This is becau,longevity vegetarian advisable vegetarian vegetarian vegetarian secret vegetarian able sick vegetarian secret longevity vegetarian tends longevity persons blood,Lily Chuang - Being a vegetarian is the secret to longevity. This is becau,Lily Chuang
Linda Collister - nan,linda collister peters small nan linda ryland peters collister ryland linda peters small collister nan,Linda Collister - nan,Linda Collister
Linda Howard - A New York Times Bestselling AuthorNo mission had ever gotte,rescuing barrie mackenzie barrie seal zane barrie lovejoy important mission barrie important authorno mission mission life zane mackenzie navy seal,Linda Howard - A New York Times Bestselling AuthorNo mission had ever gotte,Linda Howard
Linda L. Crawford - <p>Florida Real Estate Exam Manual for Sales Associates and,broker exam estate exam exam manual brokers comprehensive license exams associates brokers students broker real estate brokers broker,Linda L. Crawford - <p>Florida Real Estate Exam Manual for Sales Associates and,Linda L. Crawford
Linda LeMoncheck - Linda LeMoncheck introduces a new way of thinking and talkin,womens sexuality sexual liberation sexual deviance womens sexual sexual oppression feminist perspective feminist perspectives sexuality examined sexuality irreconcilable feminist,Linda LeMoncheck - Linda LeMoncheck introduces a new way of thinking and talkin,Linda LeMoncheck
"Lisa Harris - Living up to the reputations of her aunt Rachel, who worked",gold aaron unsolved gold missing gold determined gold tara aaron gold gold heist cache gold gold heavenly reputations aunt,"Lisa Harris - Living up to the reputations of her aunt Rachel, who worked",Lisa Harris
Lisa M. Legarde - nan,nan lisa legarde nan nan lisa legarde lisa legarde,Lisa M. Legarde - nan,Lisa M. Legarde
Lisa Trumbauer - Simple text and photographs describe life in rural areas.,life rural rural areas rural photographs life text photographs photographs simple text areas text life,Lisa Trumbauer - Simple text and photographs describe life in rural areas.,Lisa Trumbauer
"Liza Baker - Toy cars are fun to play with, but Harold wonders what it mi",toy cars cars fun toy play harold race car cars purple crayon harold car crayon,"Liza Baker - Toy cars are fun to play with, but Harold wonders what it mi",Liza Baker
"Lois Potter - A must read before tackling the works of Milton! ""A bible of",preface milton bible miltondaily milton bible works milton miltons life john milton milton english literature miltondaily miltons,"Lois Potter - A must read before tackling the works of Milton! ""A bible of",Lois Potter
Lois Richer - Georgia MacGregor is trying to escape from her painful past.,georgia macgregor macgregor macgregor trying georgia moves fears stalked camp north camp strange camp hope position camp moves camp,Lois Richer - Georgia MacGregor is trying to escape from her painful past.,Lois Richer
Lolita Bryan - nan,lolita bryan nan lolita bryan authorhouse lolita nan authorhouse bryan,Lolita Bryan - nan,Lolita Bryan
Lon O. Nordeen - nan,nordeen crown lon nordeen nan lon nordeen nan crown lon,Lon O. Nordeen - nan,Lon O. Nordeen
"Lori Hobkirk - A thorough, illustrated biography discussing the president's",presidents childhood discussing presidents biography discussing presidents biography illustrated biography term president president childhood career career family,"Lori Hobkirk - A thorough, illustrated biography discussing the president's",Lori Hobkirk
Lorraine Cook White - nan,nan lorraine genealogical publishing lorraine cook white genealogical genealogical cook white nan publishing company lorraine cook,Lorraine Cook White - nan,Lorraine Cook White
Lou Dobbs - Billions of dollars are being poured into developing busines,space tourism opportunities space players investments business opportunities billions dollars investments tourism dobbs business investments goals space new,Lou Dobbs - Billions of dollars are being poured into developing busines,Lou Dobbs
"Louis Caron - Nous sommes vers 1835, sur les rives du Saint-Laurent. Les «",en 1837 1835 sur rigoureux inondations des patriotes révolte éclatera vers 1835 patriotes elle sujet historique violemment réprimée la révolte,"Louis Caron - Nous sommes vers 1835, sur les rives du Saint-Laurent. Les «",Louis Caron
Louis L'Amour - Everyone was dead. Indian raiders massacred the entire wagon,raiders massacred indian raiders dead indian survival lessons taught hardy sevenyearold hardy teach hardy entire wagon horse survival hardy bravely,Louis L'Amour - Everyone was dead. Indian raiders massacred the entire wagon,Louis L'Amour
Louise Richardson - How can the most powerful country in the world feel so threa,terrorism terrorists defining terrorism terrorist movements experience terrorism terrorism account terrorism terrorism unite terrorists insane terrorist threat explaining terrorist,Louise Richardson - How can the most powerful country in the world feel so threa,Louise Richardson
"Lucy Rollin - Decade by decade, this resource offers an overview of all as",teens 1990s twentiethcentury teen influenced teens teen culture american teenagers teens anecdotal media decade music teen teens lived culturetwentiethcentury teen,"Lucy Rollin - Decade by decade, this resource offers an overview of all as",Lucy Rollin
Ludwig Klages - nan,bouvier verlag klages bouvier ludwig klages verlag bouvier klages nan ludwig ludwig nan,Ludwig Klages - nan,Ludwig Klages
"Luis A. Vivanco - ""Vivanco's well-written work clearly raises important questi",ecotourism costa conservation ecotourism ecotourism sustainable regarding ecotourism ecotourism ecotourism overcome tropical conservation environmental conservation monte verde nature conservation,"Luis A. Vivanco - ""Vivanco's well-written work clearly raises important questi",Luis A. Vivanco
Lundy Lewis - This unique book discusses the applications of CBR to networ,cbr network cbr paradigm applications cbr network management cbr cbr component components cbr contribution cbr computer networks managing computer,Lundy Lewis - This unique book discusses the applications of CBR to networ,Lundy Lewis
"Lydia M. Gil - Like most young children, Mimi loves Christmas time, so much",christmas mimi mimis parranda parranda mimi rico christmas mimi wants mimi loves children mimi year mimi christmas caroling instruments shell,"Lydia M. Gil - Like most young children, Mimi loves Christmas time, so much",Lydia M. Gil
"Lyn Nofziger - Lyn Nofziger is well known as an outspoken, irreverent polit",lyn nofziger nofziger ronald advisor reagans political advisor nofziger reagans press nofziger known california gubernatorial gubernatorial campaign ronald reagans,"Lyn Nofziger - Lyn Nofziger is well known as an outspoken, irreverent polit",Lyn Nofziger
Lynda La Plante - nan,plante dell la plante nan lynda lynda la lynda plante nan dell la,Lynda La Plante - nan,Lynda La Plante
Lynn Elwell Sparrow - nan,elwell sparrow edgar cayce cayce foundation sparrow edgar sparrow cayce lynn elwell nan lynn elwell foundation,Lynn Elwell Sparrow - nan,Lynn Elwell Sparrow
