Name,keywords,Id,Authors
"Eberhard Havekost - What makes Eberhard Havekost's paintings so disquieting, so",havekosts paintings paintings disquieting paintings painters skeptical involved painters painting painters paintings seven familiar painting painting styles,"Eberhard Havekost - What makes Eberhard Havekost's paintings so disquieting, so",Eberhard Havekost
"Ed Bas - Written in easy-to-understand, non-technical terms, this boo",hvac indoor indoor air proper ventilation ventilation air hazard ventilation relationship hvac indoor type indoor relationship hvac,"Ed Bas - Written in easy-to-understand, non-technical terms, this boo",Ed Bas
Editions Revue Noire - This book presents a photographic tour of northern Africa. C,naoum photography architecture morocco morocco algeria morocco algeria tunisia tunisia libya tunisia algeria northern africa africa capturing,Editions Revue Noire - This book presents a photographic tour of northern Africa. C,Editions Revue Noire
"Edmund Ruffin - History remembers Edmund Ruffin, the Virginia native believe",agricultural history history ruffins ruffin discovered ruffins activism pioneering conservationist ruffins essays soil science ruffins writings edmund ruffin agricultural study,"Edmund Ruffin - History remembers Edmund Ruffin, the Virginia native believe",Edmund Ruffin
Edna Buchanan - nan,edna buchanan buchanan random nan edna random house buchanan nan edna house random,Edna Buchanan - nan,Edna Buchanan
Edward D. O'Connor - nan,edward oconnor nan edward oconnor sunday oconnor sunday visitor edward visitor nan sunday,Edward D. O'Connor - nan,Edward D. O'Connor
Edward Sakamoto - Edward Sakamoto is one of Hawai'i's most popular playwrights,life hawaii living hawaii sakamoto hawaiis remain hawaii theme hawaii hawaii ka hawaiis popular hawaii hawaii versus hawaii glossary,Edward Sakamoto - Edward Sakamoto is one of Hawai'i's most popular playwrights,Edward Sakamoto
Edward V. Krick - nan,wiley sons edward krick nan edward john wiley sons wiley edward krick john krick nan,Edward V. Krick - nan,Edward V. Krick
"Elaine Barbieri - When Gillian Haige's father dies, his only legacy is a mount",gillian haiges gillian takes carries gillian gillian sees gillian shores unless gillian gillian ignite gillian english beauty haiges father,"Elaine Barbieri - When Gillian Haige's father dies, his only legacy is a mount",Elaine Barbieri
"Elaine Drewis - ""Word Problems"" provides a variety of activities designed to",word problems math skills motivate children problems problems provides reinforce math child work math classroom home childs needs,"Elaine Drewis - ""Word Problems"" provides a variety of activities designed to",Elaine Drewis
Elbio Dagotto - The study of the spontaneous formation of nanostructures in,manganite research manganese oxides nanoscale phase manganites formation nanostructures nanostructures single nanostructures manganites colossal magnetoresistance cmr manganese,Elbio Dagotto - The study of the spontaneous formation of nanostructures in,Elbio Dagotto
Eleanor Randolph - A journey to the grim Soviet hospitals and new Russian sex c,soviet hospitals soviet schools grim soviet russian sex decaying soviet new russian soviet russian suppressed communist suburbs author,Eleanor Randolph - A journey to the grim Soviet hospitals and new Russian sex c,Eleanor Randolph
"Eleanore M. Jewett - Amidst great mystery, Hugh is left in the care of Glastonbur",glastonbury abbey glastenburythe treasure abbey glastenburythe mystery hugh king arthur abbey father hidden treasure great abbey care glastonbury glastonbury,"Eleanore M. Jewett - Amidst great mystery, Hugh is left in the care of Glastonbur",Eleanore M. Jewett
"Elin Kelsey - Adventure and discovery await in the depths of the oceans, o",depths oceans new species oceans monkey deepsea oceans earth science exciting deepsea deepsea tubeworms species species await,"Elin Kelsey - Adventure and discovery await in the depths of the oceans, o",Elin Kelsey
Elizabeth Stephens - The rationale for Washington's enduring commitment to Israel,policy israel commitment israel support israel democratic israel israel long israel questionable israel remains israel framework american commitment israel small,Elizabeth Stephens - The rationale for Washington's enduring commitment to Israel,Elizabeth Stephens
Ellen M. Snyder-Grenier - nan,ellen snydergrenier jersey historical snydergrenier nan ellen snydergrenier new historical society new jersey jersey nan ellen,Ellen M. Snyder-Grenier - nan,Ellen M. Snyder-Grenier
Ellie Madison - What's a post-graduation trip to NYC and Europe if you don't,cosmopolitan reality cosmopolitan supposed isnt cosmopolitan wannabe cosmopolitan cosmopolitan like trip nyc cosmopolitan like cosmopolitan cosmopolitan series nyc europe,Ellie Madison - What's a post-graduation trip to NYC and Europe if you don't,Ellie Madison
"Emanuel Tov - The fourth in the series The Bible as Book, this volume char",biblical scrolls qumran discoveries qumran studies biblical text series bible bible book 1947 biblical qumran scriptures scholars chart,"Emanuel Tov - The fourth in the series The Bible as Book, this volume char",Emanuel Tov
"Encarna Castillo - As minimalism in interior design becomes more prevalent, a n",minimalism interior minimalist themes spaces minimalist baroque look interior design minimalism minimalism movement grand baroque baroque minimalist,"Encarna Castillo - As minimalism in interior design becomes more prevalent, a n",Encarna Castillo
Erhan Başyurt - Straits questions; Turkey; economic aspects.,turkey economic straits questions questions turkey straits turkey economic aspects economic questions aspects,Erhan Başyurt - Straits questions; Turkey; economic aspects.,Erhan Başyurt
"Eric Monk - The oldest keys known to exist date from around 4,000 BC in",oldest keys old keys metal keys keys known keys common ancient key backed ancient egypt secrets past bc ancient,"Eric Monk - The oldest keys known to exist date from around 4,000 BC in",Eric Monk
Eric Mylonas - <b>You Are the Ultimate Z Warrior!</b> <br />·All 15 fighter,ultimate warrior warrior warrior 15 animated series fighters 15 fighters ultimate fighting tactics fighters covered characters revealed,Eric Mylonas - <b>You Are the Ultimate Z Warrior!</b> <br />·All 15 fighter,Eric Mylonas
"Eric W. Noreen - Based on the text, Managerial Accounting, this book includes",managerial accounting costing statement accounting topics accounting accounting book process costing costing financial statement capital budgeting budgeting decisions,"Eric W. Noreen - Based on the text, Managerial Accounting, this book includes",Eric W. Noreen
Erika Rummel - This book deals with the impact of the Reformation debate in,reformation debate reformation time humanism humanism influenced impact reformation reformation says humanism saying humanism course reformation debate germany,Erika Rummel - This book deals with the impact of the Reformation debate in,Erika Rummel
Ernst Schnabel - Translated from the German by Richard and Clara Winston.,translated german richard clara clara winston german richard clara translated german winston richard,Ernst Schnabel - Translated from the German by Richard and Clara Winston.,Ernst Schnabel
Esmond Wright - nan,stoughton educational educational division hodder stoughton nan esmond wright hodder stoughton esmond wright wright nan educational,Esmond Wright - nan,Esmond Wright
Estelle Corke - Bendy Tales are brightly illustrated board books that humoro,bendy tales tail bendable toddlers book tail bend book shaped bendable bendable material bend bendy animal shape,Estelle Corke - Bendy Tales are brightly illustrated board books that humoro,Estelle Corke
Esther Burroughs - Burroughs offers a treasure chest for grandparents in this b,grandparents book grandparents gods love grandchildren grandchildren eternal help grandparents grandchildren ways chest grandparents grandparents grandchildren moments grandchildren,Esther Burroughs - Burroughs offers a treasure chest for grandparents in this b,Esther Burroughs
"Esther D. Reed - In ""The Ethics of Human Rights,"" Esther Reed constructs a Ch",theology rights human rights animal rights theology right natural rights christian theology rights esther theology reeds theology covenant noah,"Esther D. Reed - In ""The Ethics of Human Rights,"" Esther Reed constructs a Ch",Esther D. Reed
Eugene H. Falk - Falk presents the first comprehensive exposition of this gre,art reading literature art literary work reading falk literature readers historical literary representation readers readers cognitive art,Eugene H. Falk - Falk presents the first comprehensive exposition of this gre,Eugene H. Falk
Evalyn Hoover - nan,hoover aims education foundation evalyn hoover aims education nan evalyn nan hoover foundation aims education,Evalyn Hoover - nan,Evalyn Hoover
Evangelical Missiological Society - This volume traces its origins to the 2001 annual meeting of,evangelical missions evangelical missiological meeting evangelical history evangelical evangelical church community people church mission twentieth church christ scott,Evangelical Missiological Society - This volume traces its origins to the 2001 annual meeting of,Evangelical Missiological Society
"Eve Browning Cole - Here is a solid, well-reasoned introduction to feminist phil",feminist philosophy feminism philosophy feminist philosophers philosophy feminist introduction feminist feminists ecological ecological feminists indian feminists feminist criticism lesbian philosophers,"Eve Browning Cole - Here is a solid, well-reasoned introduction to feminist phil",Eve Browning Cole
Fatima Besnaci-Lancou - nan,fatima besnacilancou nan fatima besnacilancou editions fatima editions latelier editions besnacilancou latelier nan,Fatima Besnaci-Lancou - nan,Fatima Besnaci-Lancou
Federica de Cesco - nan,rex verlag federica cesco verlag nan federica cesco federica cesco rex nan rex,Federica de Cesco - nan,Federica de Cesco
Fernando García de Cortázar - nan,alianza editorial cortázar alianza garcía cortázar alianza fernando garcía garcía nan fernando editorial fernando cortázar,Fernando García de Cortázar - nan,Fernando García de Cortázar
Fernando Ortiz-Monasterio - Dr. Ortiz-Monasterio presents a step-by-step account of rhin,rhinoplasty techniques rhinoplasty rhinoplasty augmentation nose rhinoplasty basic rhinoplasty account rhinoplasty plastic surgeons nose cleft surgeons procedure cleft nose,Fernando Ortiz-Monasterio - Dr. Ortiz-Monasterio presents a step-by-step account of rhin,Fernando Ortiz-Monasterio
"Fodor's Travel Publications Inc. - <b>The best guide to Spain, updated every year</b><br /><br",guide spain spain updated vacation itineraries travel tips spain casinosexcursion morocco cafés picks restaurants cafés clubs casinosexcursion budgetparadors resorts,"Fodor's Travel Publications Inc. - <b>The best guide to Spain, updated every year</b><br /><br",Fodor's Travel Publications Inc.
"Fodor's Travel Publications Inc. - <b>The best guide to the islands, updated every year</b><br",guide islands islandsthe nightlife islandsthe islands islands updated handicrafts islandsthe travel tips vacationbeaches beaches beaches plus charter vacationbeaches,"Fodor's Travel Publications Inc. - <b>The best guide to the islands, updated every year</b><br",Fodor's Travel Publications Inc.
Fodor's Travel Publications Inc. - Fodor's Pocket Guides are designed for people who just want,pocket guides pocket frankfurt fodors pocket essential trips packagefodors pocket sights restaurants recommendations shopping shopping nightlife handy pocketsize frankfurt,Fodor's Travel Publications Inc. - Fodor's Pocket Guides are designed for people who just want,Fodor's Travel Publications Inc.
France Daigle - nan,editions dacadie dacadie france daigle daigle editions nan france editions daigle nan france,France Daigle - nan,France Daigle
Frances Burney - nan,frances burney burney michigan university press nan frances state university michigan state nan burney university michigan,Frances Burney - nan,Frances Burney
"Frances Donovan Monahan - The exhaustively revised, full-color second edition of this",patients body nurses need nursing surgical nursing adult patients nursing care patients treatment nursing nursing interventions pathways nursing,"Frances Donovan Monahan - The exhaustively revised, full-color second edition of this",Frances Donovan Monahan
"Frances Mayes - By the #1 bestselling author of ""Under the Tuscan Sun, Bella",swan novel tuscany swan bella tuscany swan haunting life tuscany author tuscan haunting novel georgia swan place swan novel,"Frances Mayes - By the #1 bestselling author of ""Under the Tuscan Sun, Bella",Frances Mayes
Frank Fortunato - -- High-interest biographies with easy-reading text about st,biographies easyreading athletes written biographies highinterest biographies sports stars star athletes famous sports books lively athletes reader books,Frank Fortunato - -- High-interest biographies with easy-reading text about st,Frank Fortunato
Frank Frazetta - This final entry in Arnie and Cathy Fenner’s Frazetta trilog,frazetta trilogy fenner frazetta paintings fullcolor paintings paintings renowned portrait artist art photos frazetta frazetta estate artist illustrator,Frank Frazetta - This final entry in Arnie and Cathy Fenner’s Frazetta trilog,Frank Frazetta
Frank O'Rourke - The year is 1964 and gold bullion is illegal to own. Private,1964 gold instant gold gold instant gold modern gold alchemy gold bullion bullion illegal enterprise capitalism human greed capitalism,Frank O'Rourke - The year is 1964 and gold bullion is illegal to own. Private,Frank O'Rourke
Franz J. Potter - To better understand and contextualise the twilight of the G,gothic publishers gothic publishing twilight gothic gothic genre history gothic gothic trade terror gothic gothic twilight disreputable tales terror,Franz J. Potter - To better understand and contextualise the twilight of the G,Franz J. Potter
Franz Werfel - nan,holt company henry holt nan franz franz werfel werfel henry holt company franz werfel henry,Franz Werfel - nan,Franz Werfel
"Fred Vargas - Danglard connaissait assez le commissaire pour comprendre, à",danglard connaissait que danglard le commissaire commissaire pour danglard se paniquant le mortellement paniquant lhumanité danglard commissaire trouvait danglard trouvait,"Fred Vargas - Danglard connaissait assez le commissaire pour comprendre, à",Fred Vargas
Frederick Douglas Shaw - Being a black man in the Wild West in the 1880s was rough. B,gunslinger west gunslingers white gunslinger town gunslingers gunslingers faster gunslinger wild west west 1880s west returning black man,Frederick Douglas Shaw - Being a black man in the Wild West in the 1880s was rough. B,Frederick Douglas Shaw
"Frederick G. Whelan - Convinced of corruption and tyranny in the Indian empire, Bu",relating burkes burkes political burkes views empire burke assessment burkes burke burkes burke led corruption tyranny india ideas,"Frederick G. Whelan - Convinced of corruption and tyranny in the Indian empire, Bu",Frederick G. Whelan
Frederick Shelley - nan,clock collectors watch clock clock frederick shelley shelley national shelley association watch nan frederick collectors nan,Frederick Shelley - nan,Frederick Shelley
G.K. Chesterton - This scarce antiquarian book is a facsimile reprint of the o,antiquarian book scarce antiquarian antiquarian facsimile reprint book facsimile reprint original modern editions reprint worlds literature literature affordable,G.K. Chesterton - This scarce antiquarian book is a facsimile reprint of the o,G.K. Chesterton
Gail Link - A half-breed with the blood of Comanche warriors in his vein,rafe rayburne veins rafe rafe make rafe gillian buchanan beauty journey independent beauty rayburne knows buchanan confident rayburne,Gail Link - A half-breed with the blood of Comanche warriors in his vein,Gail Link
"Gamal al-Ghitani - The Mahfouz Dialogs records the memories, views, and jokes o",alghitani writer literary egypt writer arabic mahfouz alghitani mahfouzs life mahfouz subjects century mahfouz islamist 1994 life islamist world literature,"Gamal al-Ghitani - The Mahfouz Dialogs records the memories, views, and jokes o",Gamal al-Ghitani
Gayle Ross - Long ago when all the creatures still spoke the same languag,language turtles persimmons turtle thief turtle turtle turtle convinced creatures spoke turtle best turtles turtles smooth greedy wolfand,Gayle Ross - Long ago when all the creatures still spoke the same languag,Gayle Ross
Gene Paolucci - THE RUNAWAY: EDDIE'S STORY is a poignant tale of a sixteen-y,eddies story runaway eddies dies eddie eddie hides fight eddie eddie runs eddie life eddie runaway york eddie,Gene Paolucci - THE RUNAWAY: EDDIE'S STORY is a poignant tale of a sixteen-y,Gene Paolucci
George A. Olah - A detailed understanding of reactive intermediates is at the,carbocation chemistry chemistry carbocations charbocation chemistry carbocations electron carbocations synthesis mechanisms carbocation studies carbocations related carbocation chemical transformations,George A. Olah - A detailed understanding of reactive intermediates is at the,George A. Olah
George D. Shuman - Following close on the heels of his celebrated debut <i>18 S,writers sherry remarkable thriller sherry moore sherry seemingly psychic sherry killer unthinkable serial killer thriller writers tortured murdered deranged killer,George D. Shuman - Following close on the heels of his celebrated debut <i>18 S,George D. Shuman
"George E. Duckworth - Originally published in 1952, <em>The Nature of Roman Comedy",roman comediesduckworth roman comedy comedies history greek comedies comediesduckworth explains comediesduckworth plautus terence comedies influence characters comedies comedies second,"George E. Duckworth - Originally published in 1952, <em>The Nature of Roman Comedy",George E. Duckworth
"George Raudzens - Based on the author's thesis, Yale, 1970.",thesis yale yale 1970 yale authors thesis thesis based authors authors 1970 based,"George Raudzens - Based on the author's thesis, Yale, 1970.",George Raudzens
Georges Roux - nan,penguin books roux penguin nan georges georges roux books roux penguin georges nan,Georges Roux - nan,Georges Roux
"Georges Simenon - René Maugras, vierundfünfzig, erfolgreicher Pariser Zeitungs",betäubenden aktivität seinem krankenhausbett krankenhausbett aus krankenhaus bicêtre das krankenhaus krankenhausbett rastlosen betäubenden pariser zeitungsverleger zeitungsverleger wird eingeliefert halbseitig,"Georges Simenon - René Maugras, vierundfünfzig, erfolgreicher Pariser Zeitungs",Georges Simenon
Gerald Bernstein - nan,bernstein bantam gerald bernstein bernstein nan gerald bantam nan gerald,Gerald Bernstein - nan,Gerald Bernstein
Gerald J. Alred - nan,bedford books books alred bedford nan gerald gerald alred bedford gerald alred nan,Gerald J. Alred - nan,Gerald J. Alred
German Fed Agency - It is in the best interest of all concerned that tourism bec,biodiversity protocol convention biodiversity conservation tourism sustainable tourism tourism sustainable biodiversity tourism protocol nature conservation proposal tourism tourism discussion,German Fed Agency - It is in the best interest of all concerned that tourism bec,German Fed Agency
"Gerry Maguire Thompson - <div>Share a sensual massage with your lover, using the most",sensual massage share sensual massage sensual techniques tantra massage lover tantra tao aromatherapy 128 mood lighting aromatherapy,"Gerry Maguire Thompson - <div>Share a sensual massage with your lover, using the most",Gerry Maguire Thompson
Gertrude Taylor - nan,macmillan publishing taylor macmillan gertrude taylor nan gertrude macmillan publishing company publishing gertrude nan taylor,Gertrude Taylor - nan,Gertrude Taylor
Giovanni Verga - nan,hueber verlag verga max giovanni verga nan giovanni verlag max hueber verga giovanni nan hueber,Giovanni Verga - nan,Giovanni Verga
"Giridhar Veeramaneni - Enjoy the journey is a collection of twenty-three, witty, hu",marriage india marriage exposes india story culture stories enjoy journey entertaining stories journey life arranged marriage experiences stories thinking enjoy,"Giridhar Veeramaneni - Enjoy the journey is a collection of twenty-three, witty, hu",Giridhar Veeramaneni
"Glenn E. Perry - <b> </b> Reflecting today's most recent findings, this enlig",eastern history middle east arabian peninsula middle eastern jihad historians islam appendix islam present rise islam arabian worldhistorical perspective,"Glenn E. Perry - <b> </b> Reflecting today's most recent findings, this enlig",Glenn E. Perry
Goretti Kyomuhendo - nan,fountain books kyomuhendo fountain fountain goretti kyomuhendo nan goretti books kyomuhendo goretti nan,Goretti Kyomuhendo - nan,Goretti Kyomuhendo
Government of NCT of Delhi - This is the first human development report prepared for Delh,human development distributional inequalities prepared delhi problems distributional development report delhi identifies delhi development inequalities makes distributional,Government of NCT of Delhi - This is the first human development report prepared for Delh,Government of NCT of Delhi
Grace Cohen Grossman - In 1996 The Skirball Museum in Los Angeles opens its doors t,skirball museum skirball cultural archaeology exhibits art museums museums collection museums jewish cultural history skirball museum museum los,Grace Cohen Grossman - In 1996 The Skirball Museum in Los Angeles opens its doors t,Grace Cohen Grossman
Grace Dent - Shiraz Bailey Wood is back! Having just about recovered from,holiday shiraz shiraz carrie shiraz bw shiraz bailey shiraz shiraz prepared wood shiraz draper shiraz shizza holiday carrie shizza,Grace Dent - Shiraz Bailey Wood is back! Having just about recovered from,Grace Dent
"Grace Paley - Poetry. "" Grace Paley is a poet of great whimsy and wisdom.",grace paley paley poet poetry grace poets poet great poet poets love original poets poetry grace,"Grace Paley - Poetry. "" Grace Paley is a poet of great whimsy and wisdom.",Grace Paley
Graham Lyle - The album-matching folio to Lyle's first studio album since,songwriters titles lyle 80s best songwriters album breakup breakup gallagher lyles studio songwriters amp lyle lyles folio lyles,Graham Lyle - The album-matching folio to Lyle's first studio album since,Graham Lyle
"Gray Jolliffe - He loves sex. She loves shoes. She dreams of clothes, flower",sex loves romance dreams sex wants loves sex dreams sex wants sex romance sex guess wants love sex,"Gray Jolliffe - He loves sex. She loves shoes. She dreams of clothes, flower",Gray Jolliffe
Greg Lemon - A biography of Montana's phenomenally popular (and ambitious,biography montanas ambitious governor governor grassroots populism montanas phenomenally populism revival governor couched populism montanas democratic party,Greg Lemon - A biography of Montana's phenomenally popular (and ambitious,Greg Lemon
"Grzegorz Rosiński - Séparés des autres membres de leur famille par une tempête,",arachnéa en fille abordent immortelle et maîtresse arachnéa thorgal et île rêveisolée une tempête paradisiaque est pour survivre ainsi lénergie,"Grzegorz Rosiński - Séparés des autres membres de leur famille par une tempête,",Grzegorz Rosiński
Guanlong Cao - Novelist Guanlong Cao's autobiographical account of growing,chinese memoirs caos autobiographical novelist guanlong memoirs caos chinese society prose memoir guanlong caos classical chinese memoir forced chinese,Guanlong Cao - Novelist Guanlong Cao's autobiographical account of growing,Guanlong Cao
"Guillaume Benoit - Examining the past, present and future of the economies of t",economies mediterranean mediterranean region mediterranean areas poverty poverty health health housing housing unemployment poverty unemployment environmental housing,"Guillaume Benoit - Examining the past, present and future of the economies of t",Guillaume Benoit
Guillaume Nicloux - nan,nicloux editions guillaume nicloux editions 84 nan guillaume nicloux editions nan guillaume 84,Guillaume Nicloux - nan,Guillaume Nicloux
Gwenda Robb - This <b>Concise Dictionary of Australian Artists</b> fills t,australian artists origins artistic artistic tendencies artists dictionary australian artists fills australian artistic art interested art,Gwenda Robb - This <b>Concise Dictionary of Australian Artists</b> fills t,Gwenda Robb
"H. Hunt Batjer - This text for neurosurgeons, neurologists, neuroradiologists",cerebral perfusion ischaemic brain brain protection neurological care reperfusion injury cerebral microvascular neurosurgeons neurologists neurosurgeons neurologists neuroradiologists protection ischaemic,"H. Hunt Batjer - This text for neurosurgeons, neurologists, neuroradiologists",H. Hunt Batjer
"H.E. Francis - The erotic, surreal, and provocative stories of Last Night o",night carnival exile aesthetic culture romero carnival erotic surreal surreal provocative kafka borges stories night exile exiled,"H.E. Francis - The erotic, surreal, and provocative stories of Last Night o",H.E. Francis
H.G. Wells - This scarce antiquarian book is a facsimile reprint of the o,antiquarian book scarce antiquarian antiquarian facsimile reprint book facsimile reprint original modern editions reprint worlds literature literature affordable,H.G. Wells - This scarce antiquarian book is a facsimile reprint of the o,H.G. Wells
"H.R.F. Keating - H.R.F. Keating wrote the book on crime fiction (several, act",plausible constable book crime constable momentarily constable detectives harriet constable titty testament keatings writing crime inspector martens detective superintendent,"H.R.F. Keating - H.R.F. Keating wrote the book on crime fiction (several, act",H.R.F. Keating
