Name,keywords,Id,Authors
Moshe Pelli - The Age of Haskalah is a seminal study of the beginnings of,haskalah hebrew hebrew enlightenment haskalah literary century haskalah beginnings haskalah maskilim talmud enlightenment germany haskalah age haskalah pundits haskalah,Moshe Pelli - The Age of Haskalah is a seminal study of the beginnings of,Moshe Pelli
Muhammad Muti Hafiz - nan,alfikr almuasir muhammad muti nan muhammad dar alfikr muti hafiz muhammad almuasir alfikr hafiz dar muti,Muhammad Muti Hafiz - nan,Muhammad Muti Hafiz
"Myrna Goldenberg - The Holocaust was a cataclysmic upheaval in politics, cultur",holocaust classroom subject holocaust holocaust subject holocaust course teachers holocaust holocaust imperative holocaust symposium holocaust cataclysmic holocaust serve story holocaust,"Myrna Goldenberg - The Holocaust was a cataclysmic upheaval in politics, cultur",Myrna Goldenberg
Nabbie Mansaray - Warum schneiden so viele Unternehmen schlecht ab im weltweit,marktvergleich der zukunftige markte weltweiten marktvergleich mit zahlreichen zahlreichen missverstandnissen schlecht ab markte erfolgreich erschliessen und marktvergleich unternehmen schlecht,Nabbie Mansaray - Warum schneiden so viele Unternehmen schlecht ab im weltweit,Nabbie Mansaray
"Nabil A.A. Nassar - This fun-filled children's adventure story, follows the clas",aladdins journey childrens adventure genie land aladdin visits visits genie journey genie adventure story aladdin lahluba aladdins genies timeless,"Nabil A.A. Nassar - This fun-filled children's adventure story, follows the clas",Nabil A.A. Nassar
Nancy J. Troy - Troy presents a study of the multiple connections between ar,haute couture fashion theatre art haute fashion reproduction fashion art visual art theatre visual theatre poiret,Nancy J. Troy - Troy presents a study of the multiple connections between ar,Nancy J. Troy
Nathan Johnstone - Nathan Johnstone looks at the ways in which beliefs about th,witchcraft examines demonology focus demonology divinity puritan devil power devil protestants influenced witchcraft demonology component puritan godliness,Nathan Johnstone - Nathan Johnstone looks at the ways in which beliefs about th,Nathan Johnstone
National Research Council - Matching DNA samples from crime scenes and suspects is rapid,forensic dna dna evidenceprovides justice dna matching dna dna samples certification dna privacy dna forensic scientists dna data law forensic,National Research Council - Matching DNA samples from crime scenes and suspects is rapid,National Research Council
Neal Shusterman - What if a seventh grader could have everything he wanted? He,sunglasses kevin seventh grader kevin kevin midass bullied took revenge bullied hes revenge style hes tired bullied,Neal Shusterman - What if a seventh grader could have everything he wanted? He,Neal Shusterman
Neil Anderson - This critical introduction discusses the origins of creativi,creativity group innovative teams managing innovative innovation managing organizational strategies approaches innovation creativity origins creativity improve organizational innovation,Neil Anderson - This critical introduction discusses the origins of creativi,Neil Anderson
Neil C. Warren - nan,neil warren warren doubleday nan neil neil warren doubleday nan,Neil C. Warren - nan,Neil C. Warren
Neil J. Smelser - Neil Smelser's <i>Social Paralysis and Social Change</i> is,industrialization education british workingclass educational change change societies education nineteenthcentury industrial revolution nineteenthcentury britain social changethis study britain industrialization,Neil J. Smelser - Neil Smelser's <i>Social Paralysis and Social Change</i> is,Neil J. Smelser
"Nelson Dunford - This classic text, written by two notable mathematicians, co",linear operations theory linear abstract theory analysis dunford linear classical analysis general theory operations applications operations mathematiciantreatment,"Nelson Dunford - This classic text, written by two notable mathematicians, co",Nelson Dunford
"Nevada Barr - It's fall in the Sierra Mountains, and Anna Pigeon is slingi",anna pigeon seasonal park undercover anna threatening park mountains anna fear annas parks annas life park employees national parks,"Nevada Barr - It's fall in the Sierra Mountains, and Anna Pigeon is slingi",Nevada Barr
Nick  Smith - Each year more than 4 million hunters pursue waterfowl speci,hunting waterfowlfrom pursue waterfowl waterfowl species ducks geese waterfowl species hunting puddle ducks waterfowlfrom hunting strategies waterfowlfrom water,Nick  Smith - Each year more than 4 million hunters pursue waterfowl speci,Nick  Smith
"Nick Hornby - <b>A wise, affecting novel from the beloved, award-winning a",novel suicide way novel mortality tale end livesin tale connections novel novel beloved starring pierce line long story individuals,"Nick Hornby - <b>A wise, affecting novel from the beloved, award-winning a",Nick Hornby
"Nicola Cornick - Under a blaze of chandeliers, in London's most fashionable c",jack kestrel club jack jacks eyes kestrel sinfully glint jacks sensual rogue londons fashionable jacks dangerous jack bowes jack,"Nicola Cornick - Under a blaze of chandeliers, in London's most fashionable c",Nicola Cornick
Nora E. Jaffary - When Europe introduced mechanisms to control New World terri,colonialism americas experiences colonialism european colonialism ethnicities colonial colonial mexico colonialism atlantic history colonial context imperialism early established women,Nora E. Jaffary - When Europe introduced mechanisms to control New World terri,Nora E. Jaffary
Norma L. Baker - Life has many peaks and valleys; it is about making choices,life peaks life life adventure lifechanging crossroads life knowing godas godas presence chances lifechanging presence god lifechanging events,Norma L. Baker - Life has many peaks and valleys; it is about making choices,Norma L. Baker
Norman Lewis - As a witness to his times - which are much of the twentieth,norman lewis ernest hemingway hemingway hemingway fidel century norman lewis lewis unmatched adventures italy ernest fleming ernest,Norman Lewis - As a witness to his times - which are much of the twentieth,Norman Lewis
Norman Mailer - Elegido por Heinrich Himmler para investigar qué hay de cier,hitler eslabón familia hitler adolf adolf hitler joven adolf heinrich himmler hitler el orígenes adolf maligno adolf adolf era,Norman Mailer - Elegido por Heinrich Himmler para investigar qué hay de cier,Norman Mailer
North American Nursing Diagnosis Association - nan,nursing diagnosis america nursing nursing american nursing nan association nandanorth nan north nandanorth nandanorth america diagnosis association,North American Nursing Diagnosis Association - nan,North American Nursing Diagnosis Association
"Obadiah Mailafia - This book explores the complex, post-colonial relationship b",europe african postcolonial relationship complex postcolonial postcolonial african states relationship europe eu agreements diplomacy dynamics diplomacy eu,"Obadiah Mailafia - This book explores the complex, post-colonial relationship b",Obadiah Mailafia
Oliver Warner - nan,penguin books nan oliver warner penguin oliver warner books nan oliver warner penguin,Oliver Warner - nan,Oliver Warner
Oscar Mandel - Fundamentals of the Art of Poetry takes the reader on a jour,art poetry poetry poetry poetry particular poets curious poetry poetry takes poets general poetry poetry energetic poet dramatist,Oscar Mandel - Fundamentals of the Art of Poetry takes the reader on a jour,Oscar Mandel
P.J. Gellings - The Handbook of Solid State Electrochemistry is a one-stop r,electrochemistry electrochemical electrochemical electrocatalysis fundamentals electrochemical properties gasphase electrocatalysis electrocatalysis electrochemical reaction conductors electrochemical electrochemical kinetics solid electrolytes,P.J. Gellings - The Handbook of Solid State Electrochemistry is a one-stop r,P.J. Gellings
Pamela Sissi Carroll - nan,nan pamela allyn bacon pamela sissi pamela bacon carroll allyn nan sissi carroll allyn carroll,Pamela Sissi Carroll - nan,Pamela Sissi Carroll
Panzac D. - nan,nan panzac panzac peeters panzac nan peeters,Panzac D. - nan,Panzac D.
Parapsychological Association - To find more information about Rowman and Littlefield titles,rowman littlefield littlefield titles rowman information rowman littlefield titles titles visit nofollow href visit targetblank targetblank,Parapsychological Association - To find more information about Rowman and Littlefield titles,Parapsychological Association
Patricia C. McKissack - The Big Bug Book series is a delightful children's book that,bug book bug series big bug child books childrens books childrens book books big book series page book illustrated bug,Patricia C. McKissack - The Big Bug Book series is a delightful children's book that,Patricia C. McKissack
Patrick Peyton - The most complete prayer book of meditations on the mysterie,mysteries rosary 230 meditations rosary prayers meditations mysteries rosary book meditations rosary set rosary today prayer book meditations,Patrick Peyton - The most complete prayer book of meditations on the mysterie,Patrick Peyton
"Patrick Williams - Four hundred years after his death, Philip II remains one of",philip ii spain philip philip death philip philip used wars philip philip proclaimed development philip monarchy spain young ruler,"Patrick Williams - Four hundred years after his death, Philip II remains one of",Patrick Williams
Patrick Wright - This is a book about the stories that lie hidden in the fold,village dorset lost village story village tale villagers dorset hamlet english landscapetyneham dorset restoration tyneham tyneham enduring vanished england,Patrick Wright - This is a book about the stories that lie hidden in the fold,Patrick Wright
Paul    Jennings - nan,jennings keele university press keele university paul jennings jennings nan paul keele university nan press,Paul    Jennings - nan,Paul    Jennings
Paul Cooke - <i>World Cinema's 'Dialogues' with Hollywood</i> looks at th,dialogues hollywood hollywood interacted hollywood talking film hollywood cinemas dialogues transnational cinemas world cinemas cinemas german cinemas economic hollywood profound,Paul Cooke - <i>World Cinema's 'Dialogues' with Hollywood</i> looks at th,Paul Cooke
"Paul H. Wender - Written by a leading child psychiatrist and researcher, this",demonstrates disorder child psychiatrist excessive activity disorder add patients disorder change learning disability add adults activity symptoms psychiatrist,"Paul H. Wender - Written by a leading child psychiatrist and researcher, this",Paul H. Wender
Paul Kenrick - The appearance of land vegetation on Earth 450 million years,fossil plants plant evolution lycopsids ferns land plants clarifies phylogenetic phylogenetic patterns ferns understanding specific phylogenetic plantsthe transition land vegetation,Paul Kenrick - The appearance of land vegetation on Earth 450 million years,Paul Kenrick
Paul Krainak - <i>Kartoon Kings</i> is the first monographic and comprehens,artwork simon simon grennan sperandio grennan grennan sperandio artwork graphic artwork christopher sperandio grennan christopher sperandio lives sperandio,Paul Krainak - <i>Kartoon Kings</i> is the first monographic and comprehens,Paul Krainak
"Paul L. Hancock - Here is a wealth of information on planet Earth, ranging fro",geology ecology history geology geology geology companion earth sciences geological marine geology shale fauna rock types history earth,"Paul L. Hancock - Here is a wealth of information on planet Earth, ranging fro",Paul L. Hancock
"Paul Lam - Dr Paul Lam, Family Physician and Tai Chi Master combined hi",teach tai teaching method book teach physician tai unique teaching tai chi chi tai effective teacher dr lam teaching help,"Paul Lam - Dr Paul Lam, Family Physician and Tai Chi Master combined hi",Paul Lam
Paul Mommaers - This volume represents the first book-length treatment in En,religiosity mysticism mysticism religiosity christian mystical mysticism unity mysticism mysticism union mystical writers relationships mysticism metaphysical mysticism contrasting spiritual,Paul Mommaers - This volume represents the first book-length treatment in En,Paul Mommaers
"Paul Swan - A complete guide to teaching with Unifix Cubes, this full-co",teaching unifix unifix cubes guide teaching lessons blackline cubes early cubes cubes fullcolor formatactivities includes lessons teaching,"Paul Swan - A complete guide to teaching with Unifix Cubes, this full-co",Paul Swan
Paul Temporal - Branding technology products is different from branding othe,branding technology notsosuccessful branding branding different branding branding initiatives loyalty internet branding types consumers feel consumer products customer loyalty,Paul Temporal - Branding technology products is different from branding othe,Paul Temporal
Paula Bernstein - nan,paula bernstein bernstein doubleday nan paula bernstein paula nan doubleday,Paula Bernstein - nan,Paula Bernstein
Paula Blankenship - Spanish edition of the book We Both Read: Lulu's Lost Shoes,read lulus lulu shoes lulus lost lost shoes childs pages lulu grade lulu lulus book read shoes level,Paula Blankenship - Spanish edition of the book We Both Read: Lulu's Lost Shoes,Paula Blankenship
Penelope Colville Paine - nan,penelope colville nan penelope colville paine publishing company paine paper penelope paper publishing nan colville publishing,Penelope Colville Paine - nan,Penelope Colville Paine
Penthouse Magazine - The hero of this story must bed twenty-six women across the,abigail zelda alphabet abigail abigail zelda debutantes playgirls story bed zelda win hero story playgirls politicos divas debutantes,Penthouse Magazine - The hero of this story must bed twenty-six women across the,Penthouse Magazine
"Petar Sarcevic - The Yearbook of Private International Law series, an annual",european law law pil european pil pil europe international law european states national pil conflict laws spanish law european community,"Petar Sarcevic - The Yearbook of Private International Law series, an annual",Petar Sarcevic
Peter  Mertens - Der Studienö und Forschungsführer Wirtschaftsinformatik info,forschungsschwerpunkten wirtschaftsinformatiköstudiengängen forschungsführer wirtschaftsinformatik wirtschaftsinformatiköstudiengängen und wirtschaftsinformatik informiert wirtschaftsinformatik arbeitsmarkt wirtschaftsinformatiköstudiengängen für wirtschaftsinformatik wirtschaftsinformatik als die wirtschaftsinformatik wirtschaftsinformatik,Peter  Mertens - Der Studienö und Forschungsführer Wirtschaftsinformatik info,Peter  Mertens
Peter Brazaitis - From catching alligators in the reservoirs of New York and c,zoos animal zoo fascinating zoo bronx zoo reptiles animalsafter superintendent reptiles job reptile look zoos zoos snake keeper,Peter Brazaitis - From catching alligators in the reservoirs of New York and c,Peter Brazaitis
Peter C. Caldwell - <i>Popular Sovereignty and the Crisis of German Constitution,german constitutional weimar political law weimar weimar republic theorists constitutional debated weimar democracy constitution weimar period constitution constitutional struggles,Peter C. Caldwell - <i>Popular Sovereignty and the Crisis of German Constitution,Peter C. Caldwell
Peter Coleman - Shopping centers have become the most common of shopping env,shopping centers shopping environments retail center mall retail retail environments enclosed mall town mall retail parks mall evolved mall,Peter Coleman - Shopping centers have become the most common of shopping env,Peter Coleman
Peter Connolly - First Published in 1999. Routledge is an imprint of Taylor &,routledge imprint francis informa informa company 1999 routledge routledge published 1999 imprint taylor informa taylor amp amp francis,Peter Connolly - First Published in 1999. Routledge is an imprint of Taylor &,Peter Connolly
Peter Dawson - These three novellas by Peter Dawson embody the dramatic str,american frontier frontier frontier unique abandoned ranch rancher claims ranch forgotten destiny tells rancher story forgotten claims land,Peter Dawson - These three novellas by Peter Dawson embody the dramatic str,Peter Dawson
Peter J. Buckley - This innovative book contains key works which examine the cu,strategies multinational multinational firms multinational firm theory multinational multinational firms global international strategy global economy international transfer joint ventures,Peter J. Buckley - This innovative book contains key works which examine the cu,Peter J. Buckley
Peter James Froning - nan,nan peter froning authorhouse peter james james froning authorhouse peter nan froning james,Peter James Froning - nan,Peter James Froning
Peter Leach - The tellers of <i>Tales of Resistance</i> speak in voices im,tellers tales tales resistance tellers slaves accused tales resistance speak resist ozark stories place slaves crimes whites,Peter Leach - The tellers of <i>Tales of Resistance</i> speak in voices im,Peter Leach
Peter Lothar Oesterreich - This collection of articles in English and German covers a w,rhetorical scholarship elocutio renaissance literature linguistics rhetorical interpretations works shakespeare ciceronian controversy shakespeare shakespeare milton rhetoric functions rhetoric reflect,Peter Lothar Oesterreich - This collection of articles in English and German covers a w,Peter Lothar Oesterreich
"Peter Morton Coan - He was one of the most beloved performers in music history,",harry chapin chapin written biography harry chapin harry cab drivers alike taxi taxi definitive laureate cab definitive biography,"Peter Morton Coan - He was one of the most beloved performers in music history,",Peter Morton Coan
Peter Small - Written for designers and programmers who feel limited by co,web concepts design design products designers programmers diagrams simple illustrated diagrams diagrams approach design wide web products services,Peter Small - Written for designers and programmers who feel limited by co,Peter Small
Peter Viemeister - nan,viemeister hamiltons peter viemeister viemeister nan peter hamiltons peter nan,Peter Viemeister - nan,Peter Viemeister
Peter W. Preston - This text provides a wide-ranging overview of the developmen,japan pacific experience japan pacific asia asia wider japan asia global political pacific development wider global,Peter W. Preston - This text provides a wide-ranging overview of the developmen,Peter W. Preston
Peter Winter - nan,garland publishing nan peter winter garland peter winter garland nan publishing peter winter,Peter Winter - nan,Peter Winter
Phil Murray - This self-help cassette set provides Phil Murray's recipe fo,affirmations inspirational phil murrays inspirational text murrays recipe selfhelp cassette visualizations affirmations inspirational life achieve selfhelp murrays,Phil Murray - This self-help cassette set provides Phil Murray's recipe fo,Phil Murray
"Philip Guedalla - Many of the earliest books, particularly those dating back t",modern editions earliest books republishing classic editions editions using expensive republishing quality modern books particularly books modern,"Philip Guedalla - Many of the earliest books, particularly those dating back t",Philip Guedalla
Philip J. Cooper - Prepare for your career in government service with PUBLIC LA,public administration administrative law legal administrative law administration administrative political public law administration book government service law public contracting public,Philip J. Cooper - Prepare for your career in government service with PUBLIC LA,Philip J. Cooper
Philip Kaplan - In the history of aviation there have been many attempts to,aircraft boeing aircraft introduced aircraft extraordinary history aviation aircraft selected boeing b52 boeing boeing b52 b49 boeing boeing 747,Philip Kaplan - In the history of aviation there have been many attempts to,Philip Kaplan
Philippe Djian - nan,editions jai djian editions jai lu jai nan philippe philippe djian editions djian nan philippe,Philippe Djian - nan,Philippe Djian
Philippe Meyer - Desde la historia de la farmacopea a la prospectiva de vangu,industria farmacéutica la farmacopea farmacopea la la industria farmacéutica al farmacéutica problemas económicos farmacopea económicos la industria,Philippe Meyer - Desde la historia de la farmacopea a la prospectiva de vangu,Philippe Meyer
"Philippe de Mézières - This French medieval text is now published in its entirety,",french medieval christian rulers pelerin philippe crusade liberate le songe france life philippe mezieres crusade vieil pelerin france study,"Philippe de Mézières - This French medieval text is now published in its entirety,",Philippe de Mézières
Phillip C. McGraw - Voy a hablarte sobre tu familia y la mía. Sé muy bien que co,familia es familia más familia sentido salud felicidad que hagamos que eso tengamos seguridad felicidad prosperidad tu familia felicidad,Phillip C. McGraw - Voy a hablarte sobre tu familia y la mía. Sé muy bien que co,Phillip C. McGraw
"Pierre Makyo - Depuis la disparition brutale de sa mère, la petite Elsa s'e",dangereux mystiques une secte sectes et des sectes ces dangereux lerrance brisée où elsa secte où brisée et religieux mais,"Pierre Makyo - Depuis la disparition brutale de sa mère, la petite Elsa s'e",Pierre Makyo
"Piers Anthony - When the Good Magician Humfrey's son Hugo suddenly vanishes,",fantasy saga magician humfreys lively imagination son mysterious storyteller piers drama origins curse hugos hugos beloved series madcap saga lively,"Piers Anthony - When the Good Magician Humfrey's son Hugo suddenly vanishes,",Piers Anthony
"Piers Bizony - In July 1996, a NASA team led by David McKay and Everett Gib",mars findings microbial life meteorite mars originate mars traces microbial discovery fossilized came mars meteorite formed traces meteorite microbial,"Piers Bizony - In July 1996, a NASA team led by David McKay and Everett Gib",Piers Bizony
Pope John Paul II - Memory and Identity offers an extraordinary message of peace,pope john pope john paul religions inspiring freedom democracy ideologies communism regard freedom volume pope paul ii civilizations religions,Pope John Paul II - Memory and Identity offers an extraordinary message of peace,Pope John Paul II
"Poul Anderson - When the human race spread out among the stars, they took th",van rijn rijn interstellar novel man wingless aliens stories van nicholas van interstellar trader nick van van polesotechnic league,"Poul Anderson - When the human race spread out among the stars, they took th",Poul Anderson
Q.K. Philander Doesticks - This scarce antiquarian book is a selection from Kessinger P,antiquarian book literature kessinger kessinger publishings kessinger publishing reprint series hardtofind books scarce antiquarian legacy reprint reprint worlds literature,Q.K. Philander Doesticks - This scarce antiquarian book is a selection from Kessinger P,Q.K. Philander Doesticks
R. Kenneth Carty - nan,carty university university toronto kenneth carty carty toronto press nan kenneth university nan toronto kenneth,R. Kenneth Carty - nan,R. Kenneth Carty
"R. Mark Tiller - The text presents an overview of political, social, and econ",real politics overview political politics policy connects politics economic ideologies political social policy debates politics political influence real,"R. Mark Tiller - The text presents an overview of political, social, and econ",R. Mark Tiller
R. McNeill Alexander - nan,ebury press nan mcneill alexander ebury mcneill alexander ebury mcneill press alexander nan,R. McNeill Alexander - nan,R. McNeill Alexander
R.M. 'Mike' Crosley - This book covers the author's flying career from the finish,naval aviation squadron boscombe british naval angled flight aircraft book naval test squadron naval carrierborne jet flight deck,R.M. 'Mike' Crosley - This book covers the author's flying career from the finish,R.M. 'Mike' Crosley
R.O. Pepin - <b>Published by the American Geophysical Union as part of th,mars atmospheres atmospheres ionospheres present atmospheres atmospheres exospheres atmosphere evolution ionospheres atmospheres ionospheres solar exospheres ionospheres atmosphere,R.O. Pepin - <b>Published by the American Geophysical Union as part of th,R.O. Pepin
"R.P. Bosch - With their appearance during the 1760s, the five instalments",laurence sternes appearance 1760s sternes life seized sternes sternes success sternes booksellers like booksellers shandy gentleman publishers,"R.P. Bosch - With their appearance during the 1760s, the five instalments",R.P. Bosch
Rachel Bryant-Waugh - Eating problems in children and teenagers are very common. Y,eating problems eating disorders eating difficulties childs eating eating behaviour eating habits concerned eating eating patterns eating disturbed eating,Rachel Bryant-Waugh - Eating problems in children and teenagers are very common. Y,Rachel Bryant-Waugh
"Rafael Cancel Miranda - In two interviews, Cancel Miranda -- one of five Puerto Rica",miranda puerto rican political rican nationalists nationalists imprisoned puerto rican miranda political prisoners cancel miranda puerto imprisoned washington,"Rafael Cancel Miranda - In two interviews, Cancel Miranda -- one of five Puerto Rica",Rafael Cancel Miranda
"Rails-to-Trails-Conservancy - With 113 rural, suburban, and urban trails threading through",railtrails midwest wisconsin railtrails urban trails trail trip miles railtrails county trail prairie path trailhead parking trails trail,"Rails-to-Trails-Conservancy - With 113 rural, suburban, and urban trails threading through",Rails-to-Trails-Conservancy
Ralph Giordano - nan,giordano harrassowitz ralph giordano harrassowitz giordano nan ralph ralph nan,Ralph Giordano - nan,Ralph Giordano
